{
  "formatVersion": 1,
  "namespace": "@adico",
  "name": "xtask registry-validate regression fixture",
  "compatibility": { "cli": ">=0.1.0" },
  "items": [
    {
      "name": "button",
      "type": "registry:ui",
      "description": "A correctly checksummed fixture item.",
      "files": [
        {
          "source": "ui/button.rs",
          "targetRoot": "ui",
          "target": "button.rs",
          "checksum": "cf584943ce7cf28a60f4e0ffc2953422425b5b8f75ddafbe0b694482827de8ac"
        }
      ]
    }
  ]
}
