{
  "formatVersion": 1,
  "namespace": "@adico",
  "name": "Awesome Dioxus Components",
  "description": "Fixture registry with one classified and one unclassified shadcn-equivalent item.",
  "compatibility": {
    "cli": ">=0.1.0"
  },
  "items": [
    {
      "name": "widget",
      "type": "registry:ui",
      "description": "A fixture item with a matching parity.json entry.",
      "files": [
        {
          "source": "ui/widget.rs",
          "targetRoot": "ui",
          "target": "widget.rs",
          "checksum": "b9a4f3ed6bc83c6a1d02e9b5c33cb0db1a6f2d56214e78d5748f7ec901fe1a00"
        }
      ],
      "documentation": {
        "slug": "widget"
      }
    },
    {
      "name": "gadget",
      "type": "registry:ui",
      "description": "A fixture item with no matching parity.json entry.",
      "files": [
        {
          "source": "ui/gadget.rs",
          "targetRoot": "ui",
          "target": "gadget.rs",
          "checksum": "c9a4f3ed6bc83c6a1d02e9b5c33cb0db1a6f2d56214e78d5748f7ec901fe1a00"
        }
      ],
      "documentation": {
        "slug": "gadget"
      }
    },
    {
      "name": "toolbar",
      "type": "registry:ui",
      "description": "A Dioxus-only extra fixture item; must not be required to have a parity.json entry.",
      "files": [
        {
          "source": "ui/toolbar.rs",
          "targetRoot": "ui",
          "target": "toolbar.rs",
          "checksum": "d9a4f3ed6bc83c6a1d02e9b5c33cb0db1a6f2d56214e78d5748f7ec901fe1a00"
        }
      ],
      "documentation": {
        "slug": "toolbar"
      }
    },
    {
      "name": "cn",
      "type": "registry:lib",
      "description": "A non-component fixture item; must not be required to have a parity.json entry.",
      "files": [
        {
          "source": "lib/cn.rs",
          "targetRoot": "lib",
          "target": "cn.rs",
          "checksum": "e9a4f3ed6bc83c6a1d02e9b5c33cb0db1a6f2d56214e78d5748f7ec901fe1a00"
        }
      ],
      "documentation": {
        "slug": "cn"
      }
    }
  ]
}
